actor_id	first_name	last_name	film_info
135	Rita	Reynolds	Animation: Luke Mummy, Children: Maker Gables, Classics: Gilbert Pelican, Jerk Paycheck, Comedy: Snatch Slipper, Trainspotting Strangers, Documentary: National Story, Family: Earring Instinct, Indian Love, Foreign: Command Darling, Gentlemen Stage, Impossible Prejudice, Horror: Arachnophobia Rollercoaster, Behavior Runaway, New: Flamingos Connecticut, Godfather Diary, Sports: Northwest Polish, Records Zorro, Travel: Arsenic Independence, Born Spinal
136	Ed	Mansfield	Action: Barefoot Manchurian, Devil Desire, Easy Gladiator, Lust Lock, Animation: Crossroads Casualties, Doors President, Falcon Volume, Oz Liaisons, Children: Daughter Madigan, Jersey Sassy, Wrong Behavior, Classics: Sling Luke, Documentary: Majestic Floats, Drama: Apollo Teen, Beauty Grease, Harold French, Something Duck, Family: Dumbo Lust, Foreign: Hellfighters Sierra, Games: Seven Swarm, State Wasteland, Music: Amelie Hellfighters, New: Angels Life, Godfather Diary, Pluto Oleander, Sleepy Japanese, Vampire Whale, Sci-Fi: Nemo Campus, Sports: Drop Waterfront, Holes Brannigan, Jade Bunch, Travel: Escape Metropolis
137	Morgan	Williams	Action: Barefoot Manchurian, Lord Arizona, Animation: Club Graffiti, Early Home, Horn Working, Juggler Hardly, Massage Image, Punk Divorce, Children: Fargo Gandhi, Polish Brooklyn, Classics: Alice Fantasia, Dracula Crystal, Comedy: Heaven Freedom, Drama: Saints Bride, Family: Movie Shakespeare, Music Boondock, Splash Gump, Foreign: Agent Truman, New: Breaking Home, Sci-Fi: Guys Falcon, Sports: Driver Annie, Durham Panky, Hysterical Grail, Roses Treasure, Star Operation, Tuxedo Mile, Travel: Desperate Trainspotting
138	Lucille	Dee	Animation: Mission Zoolander, Children: Clockwork Paradise, Daughter Madigan, Maker Gables, Classics: Westward Seabiscuit, Documentary: North Tequila, Drama: Beauty Grease, Harry Idaho, Unfaithful Kill, Family: Opposite Necklace, President Bang, Foreign: Ballroom Mockingbird, Grapes Fury, Games: Lambs Cincinatti, Roxanne Rebel, Horror: Airport Pollock, Drums Dynamite, Texas Watch, Music: Telegraph Voyage, New: Mask Peach, Sports: Hysterical Grail, Image Princess, Travel: Cassidy Wyoming, Working Microcosmos
139	Ewan	Gooding	Action: Devil Desire, Animation: Juggler Hardly, Titanic Boondock, Children: Graduate Lord, Classics: Dynamite Tarzan, Roots Remember, Summer Scarface, Comedy: Lonely Elephant, Documentary: Duffel Apocalypse, Drama: Bunch Minds, Encounters Curtain, Queen Luke, Family: Dumbo Lust, Foreign: Command Darling, Mulholland Beast, Games: Curtain Videotape, Ice Crossing, Rouge Squad, Horror: Arachnophobia Rollercoaster, Music: Amelie Hellfighters, Birch Antitrust, Enemy Odds, Lucky Flying, Oleander Clue, New: Boulevard Mob, Cleopatra Devil, Sci-Fi: Mourning Purple, Sports: Mermaid Insects, Poseidon Forever, Records Zorro, Travel: Basic Easy, Contact Anonymous, Disciple Mother
140	Whoopi	Hurt	Animation: Potter Connecticut, Sons Interview, Children: Gorgeous Bingo, Graduate Lord, Language Cowboy, Murder Antitrust, Zoolander Fiction, Classics: Right Cranes, Comedy: Strictly Scarface, Documentary: Mighty Luck, Mod Secretary, Pelican Comforts, Drama: Unfaithful Kill, Family: Killer Innocent, Robbery Bright, Secrets Paradise, Foreign: Calendar Gunfight, Cowboy Doom, Games: Roof Champion, Spy Mile, Vanilla Day, Horror: Drums Dynamite, Patton Interview, Pulp Beverly, Spirit Flintstones, Music: Outfield Massacre, New: Birds Perdition, Ridgemont Submarine, Sports: Anonymous Human, Chance Resurrection, Mother Oleander, Rider Caddyshack
141	Cate	Harris	Action: Berets Agent, Handicap Boondock, Animation: Desire Alien, Storm Happiness, Children: Crooked Frogmen, Jumping Wrath, Scarface Bang, Classics: Frost Head, Gilmore Boiled, Summer Scarface, Comedy: Crazy Home, Documentary: Modern Dorado, Wrath Mile, Drama: Sea Virgin, Family: Atlantis Cause, Spinal Rocky, Foreign: Dangerous Uptown, Greek Everyone, Intrigue Worst, Muppet Mile, Sorority Queen, Games: Stampede Disturbing, Horror: Rollercoaster Bringing, Treasure Command, Music: Personal Ladybugs, Runner Madigan, Sci-Fi: Sun Confessions, Travel: Shining Roses
142	Jada	Ryder	Action: Gosford Donnie, Kissing Dolls, Side Ark, Animation: Alter Victory, Ishtar Rocketeer, Sugar Wonka, Children: Forever Candidate, Murder Antitrust, Robbers Joon, Zoolander Fiction, Classics: Malkovich Pet, Comedy: Tramp Others, Documentary: Cupboard Sinners, Dozen Lion, Midsummer Groundhog, Raiders Antitrust, Drama: Bunch Minds, Craft Outfield, Kwai Homeward, Family: Chasing Fight, Rage Games, Games: State Wasteland, Horror: Karate Moon, Music: Lucky Flying, New: Jekyll Frogmen, Salute Apollo, Sci-Fi: Garden Island, Sun Confessions, Sports: Aladdin Calendar, Talented Homicide, Travel: Trouble Date
143	River	Dean	Action: Park Citizen, Animation: Dogma Family, Pond Seattle, Children: Jersey Sassy, Comedy: Hate Handicap, Mystic Truman, Party Knock, Pinocchio Simon, Tramp Others, Documentary: Independence Hotel, Kill Brotherhood, Mighty Luck, Pocus Pulp, Drama: Blade Polish, Queen Luke, Wardrobe Phantom, Family: Confused Candles, Movie Shakespeare, Foreign: Baby Hall, Shrek License, Sorority Queen, Games: Chicago North, Dirty Ace, Fire Wolves, Mars Roman, Horror: Spirit Flintstones, Sports: Gleaming Jawbreaker, Travel: Frogmen Breaking, Gump Date, Sweet Brotherhood, Teen Apollo
144	Angela	Witherspoon	Action: Berets Agent, Bull Shawshank, Celebrity Horn, Animation: Alter Victory, Wait Cider, Classics: Core Suit, Detective Vision, Comedy: Bringing Hysterical, Cat Coneheads, Documentary: Coast Rainbow, Halloween Nuts, Secret Groundhog, Drama: Blade Polish, Edge Kissing, Hanging Deep, Jacket Frisco, Kwai Homeward, Family: Rush Goodfellas, Foreign: Stepmom Dream, Games: Sassy Packer, Horror: Pulp Beverly, Music: Lucky Flying, New: Boulevard Mob, Day Unfaithful, Sci-Fi: Fiddler Lost, Sports: Chance Resurrection, Dude Blindness, Evolution Alter, Exorcist Sting, Mother Oleander, Peak Forever, Travel: Casablanca Super, Cassidy Wyoming, Shawshank Bubble, Tomatoes Hellfighters
145	Kim	Allen	Action: Patriot Roman, Rugrats Shakespeare, Animation: Clash Freddy, Doors President, Harper Dying, Potluck Mixed, Wait Cider, Children: Heartbreakers Bright, Classics: Jingle Sagebrush, Documentary: Independence Hotel, Notorious Reunion, Rainbow Shock, Drama: Unfaithful Kill, Family: Soup Wisdom, Foreign: Orange Grapes, Past Suicides, Reservoir Adaptation, Horror: Japanese Run, Karate Moon, Lola Agent, Music: Monster Spartacus, New: Butterfly Chocolat, Cleopatra Devil, Sci-Fi: Armageddon Lost, None Spiking, Titans Jerk, Sports: Caribbean Liberty, Exorcist Sting
146	Albert	Johansson	Animation: Fight Jawbreaker, Harper Dying, Children: Crooked Frogmen, Walls Artist, Classics: League Hellfighters, Right Cranes, Comedy: Heaven Freedom, Sweden Shining, Documentary: Homeward Cider, Metal Armageddon, Road Roxanne, Virginian Pluto, Wedding Apollo, Drama: Apollo Teen, Deceiver Betrayed, Lebowski Soldiers, West Lion, Foreign: Alley Evolution, Dangerous Uptown, Games: Candles Grapes, Monsoon Cause, Horror: Treasure Command, Undefeated Dalmations, Music: Alaska Phantom, Elf Murder, Grosse Wonderful, New: Flamingos Connecticut, Redemption Comforts, Sci-Fi: Connecticut Tramp, Express Lonely, Sports: Crusade Honey, Graceland Dynamite, Honey Ties
147	Fay	Winslet	Action: Firehouse Vietnam, Animation: Harper Dying, Oz Liaisons, Children: Polish Brooklyn, Sundance Invasion, Classics: Center Dinosaur, Frost Head, Malkovich Pet, Comedy: Connection Microcosmos, Heaven Freedom, Hurricane Affair, Documentary: Bonnie Holocaust, Expendable Stallion, Quills Bull, Family: Chasing Fight, Chisum Behavior, Foreign: Hoosiers Birdcage, War Notting, Games: Fever Empire, Lambs Cincinatti, Massacre Usual, Horror: Affair Prejudice, Gaslight Crusade, Music: Freaky Pocus, Words Hunter, New: Dragonfly Strangers, Fatal Haunted, Sci-Fi: Eyes Driving, Hamlet Wisdom, Sports: Driver Annie, Travel: Haunted Antitrust
148	Emily	Dee	Children: Christmas Moonshine, Invasion Cyclone, Scarface Bang, Classics: October Submarine, Drama: Gone Trouble, Sea Virgin, Foreign: Shrek License, Music: Chamber Italian, Rebel Airport, New: Destiny Saturday, Sci-Fi: Hollow Jeopardy, Sports: Anonymous Human, Travel: Basic Easy, Fugitive Maguire
149	Russell	Temple	Animation: Canyon Stock, Crossroads Casualties, Children: Ghost Groundhog, Santa Paris, Classics: Towers Hurricane, Comedy: Closer Bang, Connection Microcosmos, Crazy Home, Gold River, Trainspotting Strangers, Documentary: Bill Others, Pelican Comforts, Wrath Mile, Drama: Chitty Lock, Family: Bang Kwai, Chasing Fight, Indian Love, Slums Duck, Foreign: Vision Torque, Games: Glory Tracy, Volcano Texas, Music: Uncut Suicides, New: Breakfast Goldfinger, Platoon Instinct, Troopers Metal, Sci-Fi: Citizen Shrek, Sports: Novocaine Flight, Shakespeare Saddle, Travel: Comforts Rush, Frogmen Breaking, Smile Earring
150	Jayne	Nolte	Action: Bull Shawshank, Lust Lock, Primary Glass, Animation: Anaconda Confessions, Horn Working, Telemark Heartbreakers, Thief Pelican, Titanic Boondock, Wait Cider, Children: Comancheros Enemy, Invasion Cyclone, Sweethearts Suspects, Ties Hunger, Classics: Creepers Kane, Wasteland Divine, Comedy: Perfect Groove, Documentary: Dancing Fever, Notorious Reunion, Drama: Reunion Witches, Family: Bedazzled Married, Braveheart Human, Games: Feathers Metal, Ice Crossing, Lambs Cincinatti, Horror: Strangers Graffiti, Music: Outfield Massacre, New: Earth Vision, Maiden Home, Sci-Fi: English Bulworth, Sports: Hysterical Grail, Secretary Rouge, Travel: Bird Independence, Disciple Mother, Gump Date
151	Geoffrey	Heston	Action: Kissing Dolls, Midnight Westward, Animation: Punk Divorce, Telemark Heartbreakers, Titanic Boondock, Children: Gorgeous Bingo, Classics: Center Dinosaur, Jeopardy Encino, Tomorrow Hustler, Drama: Luck Opus, Family: Odds Boogie, Foreign: Command Darling, Games: Dazed Punk, Dirty Ace, Grit Clockwork, Horror: Lola Agent, Paris Weekend, Patton Interview, New: Chinatown Gladiator, Sci-Fi: Goldmine Tycoon, Sports: Instinct Airport, Mermaid Insects, Travel: Coma Head, Fugitive Maguire, Igby Maker, Working Microcosmos
152	Ben	Harris	Action: Firehouse Vietnam, Uprising Uptown, Waterfront Deliverance, Werewolf Lola, Animation: Nash Chocolat, Children: Bear Graceland, Scarface Bang, Classics: Million Ace, Musketeers Wait, Timberland Sky, Comedy: Frankenstein Stranger, Pinocchio Simon, Documentary: Dozen Lion, Family: Jason Trap, Foreign: Muppet Mile, Pet Haunting, Sorority Queen, Games: Dazed Punk, Horror: Japanese Run, New: Sting Personal, Sci-Fi: Citizen Shrek, Sports: Rider Caddyshack, Tourist Pelican
153	Minnie	Kilmer	Action: Rings Heartbreakers, Classics: Conspiracy Spirit, Jeepers Wedding, Lovely Jingle, Comedy: Hustler Party, Saddle Antitrust, Velvet Terminator, Documentary: North Tequila, Drama: Beethoven Exorcist, Savannah Town, Family: Dinosaur Secretary, Jason Trap, Foreign: Baby Hall, Jet Neighbors, Games: Tycoon Gathering, New: Chaplin License, Stock Glass, Sci-Fi: Daisy Menagerie, Soldiers Evolution, Travel: Worker Tarzan
154	Meryl	Gibson	Action: Caddyshack Jedi, Sky Miracle, Animation: Crossroads Casualties, Dares Pluto, Fight Jawbreaker, Juggler Hardly, Children: Model Fish, Comedy: Element Freddy, Pinocchio Simon, Documentary: Egg Igby, Princess Giant, Drama: Encounters Curtain, Hanging Deep, Foreign: Command Darling, Happiness United, Holiday Games, Hunger Roof, Intrigue Worst, Games: Chicago North, State Wasteland, Music: Clones Pinocchio, New: Wake Jaws, Sci-Fi: Mourning Purple, Sports: Anonymous Human, Jade Bunch, Travel: Comforts Rush, Factory Dragon, Worker Tarzan
155	Ian	Tandy	Action: Berets Agent, Fantasy Troopers, Animation: Storm Happiness, Children: Polish Brooklyn, Scarface Bang, Classics: Dracula Crystal, Comedy: Zorro Ark, Documentary: Hawk Chill, Homeward Cider, Sagebrush Clueless, Wedding Apollo, Drama: Notting Speakeasy, Family: Gladiator Westward, Foreign: Catch Amistad, Informer Double, Mixed Doors, Games: Gun Bonnie, Videotape Arsenic, Horror: Texas Watch, Music: Amelie Hellfighters, Deer Virginian, Words Hunter, Youth Kick, New: Money Harold, Sci-Fi: Citizen Shrek, Fiddler Lost, Sports: Gleaming Jawbreaker, Groove Fiction, Tights Dawn, Travel: Leathernecks Dwarfs, Shawshank Bubble
156	Fay	Wood	Animation: Gangs Pride, Classics: Extraordinary Conquerer, Comedy: Rushmore Mermaid, Drama: Greedy Roots, Kwai Homeward, Seattle Expecations, Family: Bang Kwai, Dumbo Lust, Foreign: Crystal Breaking, Intrigue Worst, Purple Movie, Games: Outbreak Divine, Horror: Family Sweet, Monterey Labyrinth, Music: Dorado Notting, Insider Arizona, New: Cleopatra Devil, Idaho Love, Sci-Fi: English Bulworth, Sports: Durham Panky, Steers Armageddon, Travel: Liaisons Sweet
157	Greta	Malden	Action: Darko Dorado, Fantasy Troopers, Midnight Westward, Sky Miracle, Animation: Flying Hook, Pride Alamo, Children: Microcosmos Paradise, Classics: Tadpole Park, Comedy: Closer Bang, Mulan Moon, Documentary: Hardly Robbers, National Story, Rainbow Shock, Wife Turn, Family: Conversation Downhill, Foreign: Gentlemen Stage, Hoosiers Birdcage, Past Suicides, Games: Dazed Punk, Haunting Pianist, Spy Mile, Horror: Analyze Hoosiers, Arabia Dogma, Carrie Bunch, Love Suicides, New: Flash Wars, Troopers Metal, Sci-Fi: Weekend Personal, Sports: Aladdin Calendar, Evolution Alter, Travel: Kick Savannah, Order Betrayed
158	Vivien	Basinger	Action: Suspects Quills, Werewolf Lola, Animation: Carol Texas, Donnie Alley, Telemark Heartbreakers, Children: Beneath Rush, Noon Papi, Tootsie Pilot, Comedy: Connection Microcosmos, Crazy Home, Mallrats United, Documentary: National Story, Smoking Barbarella, Drama: Beethoven Exorcist, Jacket Frisco, Family: House Dynamite, Spartacus Cheaper, Foreign: Baby Hall, Games: Dawn Pond, Jericho Mulan, Stampede Disturbing, Horror: Simon North, Spirit Flintstones, World Leathernecks, Music: Minority Kiss, Telegraph Voyage, New: Apocalypse Flamingos, Sci-Fi: Connecticut Tramp, Open African, Weekend Personal, Sports: Bubble Grosse, Exorcist Sting, Loser Hustler, Travel: Moulin Wake, Tomatoes Hellfighters
159	Laura	Brody	Action: Magnolia Forrester, Sky Miracle, Animation: Dares Pluto, Desire Alien, Children: Full Flatliners, Fury Murder, Comedy: Cat Coneheads, Pinocchio Simon, Wisdom Worker, Documentary: Dancing Fever, Dozen Lion, Drama: Hobbit Alien, Something Duck, Translation Summer, Family: Blood Argonauts, Foreign: Pet Haunting, Shock Cabin, Horror: Motions Details, Sinners Atlantis, Tarzan Videotape, Music: Amelie Hellfighters, New: Godfather Diary, Mask Peach, Sports: Cranes Reservoir, Travel: Fugitive Maguire, Shanghai Tycoon
160	Chris	Depp	Action: Minds Truman, Side Ark, Children: Sabrina Midnight, Tequila Past, Classics: Iron Moon, Jerk Paycheck, Volume House, Comedy: Doom Dancing, Party Knock, Drama: Gone Trouble, Family: Atlantis Cause, Foreign: Impossible Prejudice, School Jacket, Horror: Ace Goldfinger, Egypt Tenenbaums, Music: Alone Trip, Scalawag Duck, New: Eagles Panky, Wake Jaws, Travel: Speed Suit
161	Harvey	Hope	Action: Speakeasy Date, Story Side, Uprising Uptown, Animation: Borrowers Bedazzled, Oscar Gold, Telemark Heartbreakers, Children: Model Fish, Classics: Holy Tadpole, Iron Moon, Comedy: Crazy Home, Downhill Enough, Documentary: Beach Heartbreakers, Drama: Harold French, Family: Atlantis Cause, Earring Instinct, Foreign: Gentlemen Stage, Hellfighters Sierra, Pearl Destiny, Games: Encino Elf, Pizza Jumanji, Sleuth Orient, Horror: Panic Club, Rules Human, Music: Uncut Suicides, New: Boulevard Mob, Frontier Cabin, Unbreakable Karate, Sci-Fi: Panther Reds, Random Go, Unforgiven Zoolander, Sports: Caribbean Liberty, Travel: Lock Rear
162	Oprah	Kilmer	Action: Midnight Westward, Park Citizen, Werewolf Lola, Animation: Alter Victory, Carol Texas, Children: Heartbreakers Bright, Shepherd Midsummer, Comedy: Airplane Sierra, Anthem Luke, Heaven Freedom, Documentary: Academy Dinosaur, Bonnie Holocaust, Coast Rainbow, Egg Igby, Drama: Apollo Teen, Foreign: Kiss Glory, Horror: Affair Prejudice, High Encino, Treasure Command, Music: Oleander Clue, New: Apocalypse Flamingos, Sports: Elizabeth Shane, Mussolini Spoilers, Steers Armageddon, Travel: Arsenic Independence
163	Christopher	West	Action: Fantasy Troopers, Animation: Dogma Family, Children: Fargo Gandhi, Heartbreakers Bright, Splendor Patton, Classics: Color Philadelphia, Conspiracy Spirit, Timberland Sky, Comedy: Hustler Party, Life Twisted, Documentary: Young Language, Foreign: Vision Torque, Horror: Anything Savannah, Temple Attraction, New: Attraction Newton, Ending Crowds, Sci-Fi: Hamlet Wisdom, Sports: Records Zorro, Travel: Fellowship Autumn, Horror Reign, Shawshank Bubble
164	Humphrey	Willis	Action: Dream Pickup, Animation: Anaconda Confessions, Sons Interview, Children: Sister Freddy, Classics: Iron Moon, Comedy: Flintstones Happiness, Mystic Truman, Documentary: Princess Giant, Spoilers Hellfighters, Family: Music Boondock, Splash Gump, Foreign: Alien Center, Chocolate Duck, Hoosiers Birdcage, Madness Attacks, Trap Guys, War Notting, Wonderful Drop, Music: Personal Ladybugs, Terminator Club, New: Idaho Love, Sci-Fi: Goldmine Tycoon, Sports: Pirates Roxanne, Straight Hours, Travel: Comforts Rush, Games Bowfinger
165	Al	Garland	Action: Drifter Commandments, Glass Dying, Grail Frankenstein, Handicap Boondock, Park Citizen, Animation: Oscar Gold, Potter Connecticut, Children: Splendor Patton, Classics: Wasteland Divine, Documentary: Bill Others, Drama: Chitty Lock, Dalmations Sweden, Jacket Frisco, Family: House Dynamite, Splash Gump, Foreign: Holiday Games, Muppet Mile, Vision Torque, Games: Sleuth Orient, Horror: Rock Instinct, New: Breakfast Goldfinger, Voice Peach, Sci-Fi: Silverado Goldfinger, Sports: Sense Greek, Slipper Fidelity, Travel: Enough Raging
166	Nick	Degeneres	Action: Ark Ridgemont, Animation: Flying Hook, Children: Betrayed Rear, Classics: Extraordinary Conquerer, Comedy: Zorro Ark, Documentary: Newsies Story, Ship Wonderland, Drama: Beauty Grease, Chitty Lock, Goldfinger Sensibility, Virgin Daisy, Family: Super Wyoming, Foreign: Pet Haunting, Games: Feathers Metal, Music: Boogie Amelie, Driving Polish, Home Pity, New: Angels Life, Mine Titans, Sci-Fi: Barbarella Streetcar, Random Go, Sports: Gleaming Jawbreaker
167	Laurence	Bullock	Action: Rear Trading, Side Ark, Sky Miracle, Animation: Potluck Mixed, Children: Crooked Frogmen, Noon Papi, Sundance Invasion, Classics: Frost Head, Malkovich Pet, Comedy: Perfect Groove, Documentary: Bill Others, Road Roxanne, Drama: Bunch Minds, Tenenbaums Command, Unfaithful Kill, Family: Bedazzled Married, Horror: Sinners Atlantis, Streetcar Intentions, Music: Alone Trip, New: Angels Life, Sci-Fi: Fish Opus, Sports: Caribbean Liberty, Northwest Polish, Travel: Expecations Natural, Frogmen Breaking, Kick Savannah
168	Will	Wilson	Action: Barefoot Manchurian, Campus Remember, Uprising Uptown, Animation: Dares Pluto, Donnie Alley, Horn Working, Theory Mermaid, Titanic Boondock, Children: Noon Papi, Ties Hunger, Warlock Werewolf, Classics: Cruelty Unforgiven, Pajama Jawbreaker, Comedy: Crazy Home, Documentary: French Holiday, Games: Gun Bonnie, Human Graffiti, Sleuth Orient, Horror: Bowfinger Gables, Sleeping Suspects, Music: Driving Polish, New: Apocalypse Flamingos, Fatal Haunted, Platoon Instinct, Sci-Fi: Mourning Purple, Sports: Divorce Shining, Liberty Magnificent, Neighbors Charade, Pickup Driving, Star Operation, Travel: Speed Suit
169	Kenneth	Hoffman	Animation: Blackout Private, Flying Hook, Gangs Pride, Massage Image, Storm Happiness, Children: Labyrinth League, Classics: Prejudice Oleander, Snatchers Montezuma, Documentary: Dozen Lion, Metal Armageddon, Wrath Mile, Drama: Torque Bound, Family: Odds Boogie, Resurrection Silverado, Secrets Paradise, Foreign: Agent Truman, Doubtfire Labyrinth, Horror: Family Sweet, Zhivago Core, Music: Hanover Galaxy, Personal Ladybugs, New: Brannigan Sunrise, Eve Resurrection, Stock Glass, Wake Jaws, Sports: Graceland Dynamite, Travel: Horror Reign, Order Betrayed, Tomatoes Hellfighters
170	Mena	Hopper	Action: Darn Forrester, Animation: Theory Mermaid, Children: Wrong Behavior, Classics: Conspiracy Spirit, Core Suit, Gilmore Boiled, Lover Truman, Comedy: Airplane Sierra, Documentary: United Pilot, Young Language, Drama: Apollo Teen, Saints Bride, Family: Chasing Fight, Foreign: Alien Center, Highball Potter, Purple Movie, Games: Lambs Cincinatti, Music: Taxi Kick, Sports: Anonymous Human, Bubble Grosse, Flatliners Killer, Saturday Lambs, Travel: Factory Dragon, Superfly Trip
171	Olympia	Pfeiffer	Action: Firehouse Vietnam, Magnolia Forrester, Animation: Storm Happiness, Titanic Boondock, Wait Cider, Children: Idols Snatchers, Murder Antitrust, Santa Paris, Classics: Color Philadelphia, Documentary: Deep Crusade, Intolerable Intentions, Drama: Chitty Lock, Family: Effect Gladiator, Foreign: Maude Mod, Games: Ice Crossing, Mars Roman, Psycho Shrunk, Sci-Fi: Badman Dawn, Express Lonely, Hanky October, None Spiking, Sports: Sense Greek, Tourist Pelican, Travel: Contact Anonymous, Fugitive Maguire, Others Soup, Sweet Brotherhood, Traffic Hobbit
172	Groucho	Williams	Animation: Oz Liaisons, Children: Hollywood Anonymous, Splendor Patton, Warlock Werewolf, Classics: Jingle Sagebrush, Roots Remember, Comedy: Groundhog Uncut, Lonely Elephant, Drama: Gone Trouble, Saints Bride, Scorpion Apollo, Family: Gables Metropolis, Opposite Necklace, Rage Games, Foreign: Brooklyn Desert, Chocolate Duck, Kane Exorcist, Meet Chocolate, Past Suicides, Games: Dawn Pond, Fantasia Park, New: Loverboy Attacks, Sports: Peach Innocent, Travel: Basic Easy, Muscle Bright
173	Alan	Dreyfuss	Action: Clueless Bucket, Animation: Clash Freddy, Massage Image, Children: Jumping Wrath, Polish Brooklyn, Strangelove Desire, Uptown Young, Comedy: Crazy Home, Lonely Elephant, Strictly Scarface, Documentary: Metal Armageddon, Sagebrush Clueless, Drama: Greedy Roots, Family: Blanket Beverly, Maguire Apache, Rush Goodfellas, Games: Bulworth Commandments, Horror: Fidelity Devil, Music: Birch Antitrust, Monster Spartacus, Uncut Suicides, New: Vampire Whale, Sci-Fi: Badman Dawn, Barbarella Streetcar, Divide Monster, Travel: Haunted Antitrust, Kick Savannah
174	Michael	Bening	Action: Park Citizen, Women Dorado, Children: Comancheros Enemy, Strangelove Desire, Stranger Strangers, Documentary: Newsies Story, Drama: Beauty Grease, Necklace Outbreak, Spice Sorority, Family: Hunting Musketeers, Music Boondock, Sensibility Rear, Foreign: Alamo Videotape, Purple Movie, Games: Gathering Calendar, Horror: Reef Salute, Spirit Flintstones, Music: Silence Kane, Telegraph Voyage, New: Pianist Outfield, Sci-Fi: Eyes Driving, Sports: Slipper Fidelity, Travel: Igby Maker, Kick Savannah
175	William	Hackman	Action: Antitrust Tomatoes, Berets Agent, Children: Crooked Frogmen, Holocaust Highball, Classics: Creepers Kane, Spiking Element, Comedy: Wisdom Worker, Documentary: Cause Date, National Story, Drama: Hunchback Impossible, Sea Virgin, Family: Hunting Musketeers, Secrets Paradise, Foreign: Trap Guys, Games: Glory Tracy, Jericho Mulan, Monsoon Cause, Moonshine Cabin, State Wasteland, Horror: Alabama Devil, Zhivago Core, New: Cleopatra Devil, Sports: Records Zorro, Rider Caddyshack, Tights Dawn, Travel: Haunted Antitrust, Window Side
176	Jon	Chase	Action: Clueless Bucket, Dream Pickup, Fantasy Troopers, Hills Neighbors, Sky Miracle, Animation: Borrowers Bedazzled, Insects Stone, Sugar Wonka, Children: Doctor Grail, Microcosmos Paradise, Documentary: Cider Desire, Hunter Alter, Drama: Harold French, Lies Treatment, Saints Bride, Spice Sorority, Family: Indian Love, Virtual Spoilers, Foreign: Reservoir Adaptation, Games: Private Drop, Rouge Squad, Horror: Ali Forever, Rollercoaster Bringing, New: Flamingos Connecticut, Sci-Fi: Bingo Talented, Stallion Sundance, Sports: Lesson Cleopatra, Travel: Madigan Dorado, Sweet Brotherhood
177	Gene	Mckellen	Animation: Horn Working, Oz Liaisons, Comedy: Crazy Home, Life Twisted, Drama: Harold French, Pity Bound, Spice Sorority, Treatment Jekyll, Family: Confused Candles, Indian Love, Foreign: Ballroom Mockingbird, Reservoir Adaptation, Games: Massacre Usual, Pizza Jumanji, Wanda Chamber, Music: Alaska Phantom, Boogie Amelie, Go Purple, New: Eve Resurrection, Runaway Tenenbaums, Sci-Fi: Armageddon Lost, Barbarella Streetcar, Divide Monster, Sports: Divorce Shining, Satisfaction Confidential, Saturday Lambs, Travel: Madigan Dorado
178	Lisa	Monroe	Action: Crow Grease, Animation: Club Graffiti, Classics: Lover Truman, Roots Remember, Comedy: Zorro Ark, Documentary: Coast Rainbow, Mod Secretary, Quills Bull, Drama: Chitty Lock, Family: Effect Gladiator, Foreign: Fiction Christmas, Games: Jericho Mulan, Sassy Packer, Horror: Anything Savannah, Arabia Dogma, Music: Won Dares, New: Butterfly Chocolat, Wild Apollo, Sci-Fi: Hanky October, Vacation Boondock, Sports: Crusade Honey, Lesson Cleopatra, River Outlaw
179	Ed	Guiness	Action: Dragon Squad, Rings Heartbreakers, Animation: Crossroads Casualties, Juggler Hardly, Children: Invasion Cyclone, Model Fish, Strangelove Desire, Classics: Center Dinosaur, Comedy: Closer Bang, Documentary: Bonnie Holocaust, Pacific Amistad, Princess Giant, Wars Pluto, Foreign: Gentlemen Stage, Maude Mod, School Jacket, Games: Wind Phantom, Horror: Analyze Hoosiers, Behavior Runaway, High Encino, Rock Instinct, New: Butterfly Chocolat, Sci-Fi: Soldiers Evolution, Unforgiven Zoolander, Sports: Anonymous Human, Evolution Alter, Instinct Airport, Travel: Smile Earring, Valentine Vanishing
