actor_id	first_name	last_name	film_info
92	Kirsten	Akroyd	Action: Devil Desire, Sky Miracle, Speakeasy Date, Stagecoach Armageddon, Worst Banger, Animation: Ishtar Rocketeer, Massage Image, Children: Labyrinth League, Magic Mallrats, Maker Gables, Ties Hunger, Classics: League Hellfighters, Comedy: Hurricane Affair, Memento Zoolander, Documentary: Raiders Antitrust, Drama: Necklace Outbreak, Paths Control, Reunion Witches, Family: Braveheart Human, Foreign: Bugsy Song, Dangerous Uptown, Madness Attacks, Usual Untouchables, Games: Grinch Massage, Private Drop, New: Boulevard Mob, Hours Rage, Pluto Oleander, Sci-Fi: Charade Duffel, Frisco Forrest, Sports: Image Princess, Travel: Bucket Brotherhood, Casablanca Super, Madigan Dorado
93	Ellen	Presley	Action: Women Dorado, Animation: Floats Garden, Oscar Gold, Turn Star, Children: Casper Dragonfly, Empire Malkovich, Microcosmos Paradise, Scarface Bang, Classics: Hyde Doctor, Roots Remember, Tadpole Park, Comedy: Pinocchio Simon, Documentary: Homeward Cider, Drama: Jacket Frisco, Family: Bilko Anonymous, Network Peak, Games: Private Drop, Spy Mile, Horror: Streetcar Intentions, Treasure Command, Sports: Caribbean Liberty, Image Princess, Pickup Driving, Secretary Rouge, Travel: Frogmen Breaking
94	Kenneth	Torn	Animation: Crossroads Casualties, Harper Dying, Children: Ghost Groundhog, Classics: Beast Hunchback, Detective Vision, League Hellfighters, Magnificent Chitty, Volume House, Documentary: Dancing Fever, Independence Hotel, Raiders Antitrust, Rainbow Shock, Ship Wonderland, Drama: Jacket Frisco, Lies Treatment, Seattle Expecations, Family: Homicide Peach, Remember Diary, Foreign: Frida Slipper, Lost Bird, Horror: Ali Forever, Carrie Bunch, Egypt Tenenbaums, Japanese Run, Music: Birdcage Casper, Lucky Flying, New: Earth Vision, Flamingos Connecticut, Maiden Home, Sci-Fi: Citizen Shrek, Sports: Flatliners Killer, Lesson Cleopatra, Travel: Working Microcosmos
95	Daryl	Wahlberg	Action: Casualties Encino, Forrest Sons, Grail Frankenstein, Rugrats Shakespeare, Animation: Double Wrath, Pond Seattle, Children: Holocaust Highball, Classics: Spiking Element, Comedy: Life Twisted, Documentary: North Tequila, Streak Ridgemont, Drama: Unfaithful Kill, Family: Killer Innocent, Foreign: Baby Hall, Ballroom Mockingbird, Dangerous Uptown, Gentlemen Stage, Hoosiers Birdcage, Games: Madre Gables, Horror: Arachnophobia Rollercoaster, Behavior Runaway, Family Sweet, Music: Birch Antitrust, New: Amistad Midsummer, Maiden Home, Sci-Fi: Fiddler Lost, Sports: Holes Brannigan, Neighbors Charade, Smoochy Control, Travel: Expecations Natural, Traffic Hobbit
96	Gene	Willis	Action: Werewolf Lola, Animation: Argonauts Town, Champion Flatliners, Hook Chariots, Children: Beneath Rush, Classics: Tadpole Park, Documentary: Army Flintstones, Beach Heartbreakers, Virginian Pluto, Drama: Darkness War, Family: Secrets Paradise, Splash Gump, Foreign: Illusion Amelie, Jet Neighbors, Past Suicides, Horror: Airport Pollock, Music: Banger Pinocchio, Dorado Notting, Words Hunter, New: Flamingos Connecticut, Money Harold, Sting Personal, Sci-Fi: Metropolis Coma
97	Meg	Hawke	Children: Gorgeous Bingo, Maker Gables, Sabrina Midnight, Classics: Gilmore Boiled, Summer Scarface, Voyage Legally, Comedy: Crazy Home, Documentary: Intolerable Intentions, Sagebrush Clueless, Drama: Chill Luck, Reunion Witches, Family: Gandhi Kwai, House Dynamite, Foreign: Orange Grapes, Vision Torque, New: Mask Peach, Vampire Whale, Sci-Fi: Connecticut Tramp, Fiddler Lost, Vacation Boondock, Sports: Crusade Honey, Drop Waterfront, Hysterical Grail, Travel: Fugitive Maguire, Liaisons Sweet, Papi Necklace, Speed Suit
98	Chris	Bridges	Action: Crow Grease, Darn Forrester, Children: Beneath Rush, Walls Artist, Classics: Extraordinary Conquerer, Requiem Tycoon, Comedy: Saturn Name, Documentary: Bill Others, Road Roxanne, Drama: Bunch Minds, Family: Conversation Downhill, Odds Boogie, Rage Games, Spartacus Cheaper, Spinal Rocky, Foreign: Muppet Mile, Purple Movie, Rocketeer Mother, Horror: World Leathernecks, Music: Reds Pocus, New: Pluto Oleander, Sci-Fi: Blindness Gun, Trojan Tomorrow, Wonderland Christmas, Sports: Caribbean Liberty, Shakespeare Saddle, Travel: Boondock Ballroom
99	Jim	Mostel	Action: Dragon Squad, Women Dorado, Animation: Floats Garden, Classics: League Hellfighters, Comedy: Airplane Sierra, Perfect Groove, Wisdom Worker, Documentary: Newsies Story, Drama: Necklace Outbreak, Foreign: Hellfighters Sierra, Reservoir Adaptation, Games: Grinch Massage, Spy Mile, Horror: Japanese Run, Motions Details, Music: Lucky Flying, Oleander Clue, Roman Punk, New: Jumanji Blade, Sci-Fi: Metropolis Coma, Nemo Campus, Weekend Personal, Sports: Anonymous Human, Flatliners Killer, Sierra Divide, Travel: Boiled Dares
100	Spencer	Depp	Action: Dragon Squad, Story Side, Worst Banger, Animation: Canyon Stock, Classics: Snatchers Montezuma, Documentary: Wrath Mile, Drama: Virgin Daisy, Witches Panic, Foreign: Hellfighters Sierra, Games: Massacre Usual, Tycoon Gathering, Horror: Treasure Command, Music: Alone Trip, Heavenly Gun, Rebel Airport, Taxi Kick, New: Salute Apollo, Sting Personal, Sci-Fi: Random Go, Weekend Personal, Sports: Sense Greek, Travel: Leathernecks Dwarfs, Order Betrayed, Sweet Brotherhood
101	Susan	Davis	Action: Dragon Squad, Lawrence Love, Children: Beneath Rush, Jumping Wrath, Murder Antitrust, Uptown Young, Classics: Beast Hunchback, Spiking Element, Comedy: Memento Zoolander, Searchers Wait, Valley Packer, Wisdom Worker, Documentary: Bonnie Holocaust, Drama: Chitty Lock, Paths Control, Saints Bride, Family: Natural Stock, Prix Undefeated, Foreign: Wonderful Drop, Games: Creatures Shakespeare, Videotape Arsenic, Horror: Egypt Tenenbaums, Karate Moon, Pulp Beverly, Music: Driving Polish, Vanishing Rocky, Wizard Coldblooded, New: Eve Resurrection, Sci-Fi: Panther Reds, Sports: Durham Panky, Star Operation, Travel: Shining Roses, Worker Tarzan
102	Walter	Torn	Action: Crow Grease, Dances None, Forrest Sons, Sky Miracle, Animation: Early Home, Flying Hook, Children: Casper Dragonfly, Jersey Sassy, Strangelove Desire, Classics: Roots Remember, Spiking Element, Comedy: Lonely Elephant, Stage World, Documentary: Madison Trap, Raiders Antitrust, Drama: Hobbit Alien, Lies Treatment, Reunion Witches, Wardrobe Phantom, Witches Panic, Family: Bang Kwai, Slums Duck, Foreign: Hoosiers Birdcage, Mulholland Beast, Stepmom Dream, Games: Curtain Videotape, Lambs Cincinatti, Nightmare Chill, Horror: Arabia Dogma, Freddy Storm, Gaslight Crusade, Motions Details, Music: Amelie Hellfighters, Wizard Coldblooded, Sports: Hysterical Grail, Lesson Cleopatra, Mummy Creatures, Novocaine Flight, Sierra Divide, Travel: Casablanca Super, Lock Rear
103	Matthew	Leigh	Action: Celebrity Horn, Easy Gladiator, Firehouse Vietnam, Glass Dying, Animation: Canyon Stock, Potluck Mixed, Children: Giant Troopers, Robbers Joon, Classics: Tomorrow Hustler, Documentary: Cupboard Sinners, Dancing Fever, Deliverance Mulholland, Drama: Mob Duffel, Orient Closer, Vietnam Smoochy, Family: African Egg, Finding Anaconda, House Dynamite, Opposite Necklace, Soup Wisdom, Games: Dawn Pond, Wanda Chamber, Music: Freaky Pocus, Greatest North, Sci-Fi: English Bulworth, Trojan Tomorrow, Sports: Crusade Honey, Travel: Games Bowfinger, Muscle Bright, Traffic Hobbit
104	Penelope	Cronyn	Action: Amadeus Holy, Entrapment Satisfaction, Animation: Bikini Borrowers, Duck Racer, Mission Zoolander, Titanic Boondock, Children: Bear Graceland, Zoolander Fiction, Classics: Core Suit, Comedy: Paradise Sabrina, Documentary: Army Flintstones, Clerks Angels, Untouchables Sunrise, Virginian Pluto, Drama: Harold French, Rocky War, Family: Feud Frogmen, Foreign: Crystal Breaking, Muppet Mile, Wonderful Drop, Horror: Fidelity Devil, Lady Stage, Motions Details, Train Bunch, Music: Legend Jedi, New: Chaplin License, Pianist Outfield, Sci-Fi: Armageddon Lost, Hamlet Wisdom, Sports: Instinct Airport, Travel: Disciple Mother
105	Sidney	Crowe	Action: American Circus, Antitrust Tomatoes, Lord Arizona, Truman Crazy, Animation: Dogma Family, Oz Liaisons, Children: Empire Malkovich, Sundance Invasion, Wrong Behavior, Classics: Candidate Perdition, Comedy: Submarine Bed, Tramp Others, Drama: Treatment Jekyll, Family: Finding Anaconda, Grease Youth, Siege Madre, Foreign: Alien Center, Games: Spy Mile, Horror: World Leathernecks, Music: Alaska Phantom, Clones Pinocchio, Freaky Pocus, New: Ending Crowds, Mannequin Worst, Mask Peach, Pluto Oleander, Run Pacific, Wake Jaws, Wyoming Storm, Sci-Fi: Spirited Casualties, Titans Jerk, Sports: Artist Coldblooded, Graceland Dynamite, Mummy Creatures
106	Groucho	Dunst	Action: Casualties Encino, Crow Grease, Devil Desire, Park Citizen, Animation: Donnie Alley, Children: Labyrinth League, Classics: Color Philadelphia, Iron Moon, Comedy: Gold River, Submarine Bed, Documentary: Independence Hotel, Pocus Pulp, Drama: Dalmations Sweden, Hunchback Impossible, Mob Duffel, Family: Blues Instinct, Gables Metropolis, Opposite Necklace, Sensibility Rear, Sunset Racer, Foreign: Happiness United, Kiss Glory, Maude Mod, Games: Creatures Shakespeare, Panky Submarine, Vanilla Day, Horror: Temple Attraction, Music: Runner Madigan, New: Butch Panther, Chaplin License, Phantom Glory, Sci-Fi: Attacks Hate, Married Go, Sports: Satisfaction Confidential, Travel: Tomatoes Hellfighters
107	Gina	Degeneres	Action: Clueless Bucket, Excitement Eve, Midnight Westward, Animation: Dogma Family, Hook Chariots, Storm Happiness, Sugar Wonka, Children: Hall Cassidy, Heartbreakers Bright, Classics: Hyde Doctor, Magnificent Chitty, Comedy: Gunfight Moon, Searchers Wait, Trainspotting Strangers, Documentary: Bed Highball, Metal Armageddon, Wife Turn, Drama: Coneheads Smoochy, Darkness War, Family: Gandhi Kwai, Indian Love, Louisiana Harry, Movie Shakespeare, Foreign: Calendar Gunfight, Intrigue Worst, Games: Seven Swarm, Horror: Elephant Trojan, Music: Chamber Italian, Deer Virginian, Impact Aladdin, Telegraph Voyage, New: Chaplin License, Sci-Fi: Chariots Conspiracy, Coldblooded Darling, Frisco Forrest, Goodfellas Salute, License Weekend, Open African, Spirited Casualties, Sports: Mummy Creatures, Sierra Divide, Travel: Window Side
108	Warren	Nolte	Animation: Dares Pluto, Potter Connecticut, Pride Alamo, Thief Pelican, Titanic Boondock, Classics: Pajama Jawbreaker, Roots Remember, Comedy: Doom Dancing, Documentary: Academy Dinosaur, Deep Crusade, Wedding Apollo, Drama: Greedy Roots, Wardrobe Phantom, Foreign: Agent Truman, Meet Chocolate, Games: Fantasia Park, Ladybugs Armageddon, Horror: Alabama Devil, Kentuckian Giant, Pulp Beverly, Music: Elf Murder, Greatest North, Personal Ladybugs, Reds Pocus, Roman Punk, New: Mask Peach, Unbreakable Karate, Sci-Fi: Charade Duffel, Garden Island, Panther Reds, Sports: Lesson Cleopatra, River Outlaw, Travel: Outlaw Hanky, Tomatoes Hellfighters
109	Sylvester	Dern	Action: Rings Heartbreakers, Animation: Doors President, Children: Backlash Undefeated, Clockwork Paradise, Shepherd Midsummer, Walls Artist, Classics: Creepers Kane, Prejudice Oleander, Comedy: Paradise Sabrina, Documentary: Halloween Nuts, Newsies Story, Family: Prix Undefeated, Rush Goodfellas, Games: Encino Elf, Horror: Texas Watch, Music: Alaska Phantom, Confidential Interview, New: Birds Perdition, Sci-Fi: Sun Confessions, Weekend Personal, Sports: Instinct Airport, Travel: Shawshank Bubble
110	Susan	Davis	Action: Casualties Encino, Excitement Eve, Glass Dying, Children: Full Flatliners, Sister Freddy, Classics: Loathing Legally, Documentary: Bed Highball, Clerks Angels, Pacific Amistad, Drama: Luck Opus, Foreign: Hotel Happiness, Madness Attacks, Wash Heavenly, Horror: Airport Pollock, Music: Words Hunter, Sci-Fi: Goodfellas Salute, None Spiking, Trojan Tomorrow, Sports: Anonymous Human, Caribbean Liberty, Travel: Leathernecks Dwarfs
111	Cameron	Zellweger	Action: Clueless Bucket, Crow Grease, Rings Heartbreakers, Animation: Blackout Private, Floats Garden, Juggler Hardly, Children: Murder Antitrust, Classics: Right Cranes, Roots Remember, Wasteland Divine, Comedy: Mallrats United, Pinocchio Simon, Documentary: Hawk Chill, Wife Turn, Drama: Beauty Grease, Bright Encounters, Conquerer Nuts, Harry Idaho, Orient Closer, Family: Gladiator Westward, Movie Shakespeare, Pilot Hoosiers, Foreign: Hellfighters Sierra, Pearl Destiny, Games: Grit Clockwork, Lambs Cincinatti, Private Drop, Tycoon Gathering, Horror: Rock Instinct, New: Stock Glass, Sports: Jade Bunch, Secretary Rouge, Travel: Tomatoes Hellfighters
112	Russell	Bacall	Action: Suspects Quills, Animation: Sunrise League, Children: Idols Snatchers, Classics: Arizona Bang, Comedy: Crazy Home, Hurricane Affair, Drama: Confessions Maguire, Paycheck Wait, Reunion Witches, Sea Virgin, Family: Dinosaur Secretary, Movie Shakespeare, Prix Undefeated, Spinal Rocky, Foreign: Matrix Snowman, Games: Panky Submarine, Horror: Arabia Dogma, Streetcar Intentions, Sci-Fi: Cincinatti Whisperer, Fiddler Lost, Soldiers Evolution, Sports: Flatliners Killer, Mummy Creatures, Sierra Divide, Travel: Worker Tarzan
113	Morgan	Hopkins	Action: Excitement Eve, Rings Heartbreakers, Rugrats Shakespeare, Stagecoach Armageddon, Classics: Candidate Perdition, Dracula Crystal, Loathing Legally, Comedy: Pinocchio Simon, Drama: Deceiver Betrayed, Harry Idaho, West Lion, Family: Prix Undefeated, Foreign: Gentlemen Stage, Pet Haunting, Reservoir Adaptation, Horror: Arachnophobia Rollercoaster, Drums Dynamite, Music: Uncut Suicides, Sci-Fi: Reign Gentlemen, Sports: Flatliners Killer, Records Zorro, Tights Dawn, Travel: Boiled Dares, Contact Anonymous, Order Betrayed, Papi Necklace, Wolves Desire
114	Morgan	Mcdormand	Action: Clueless Bucket, Crow Grease, Darko Dorado, Children: Betrayed Rear, Wrong Behavior, Classics: Holy Tadpole, Comedy: Crazy Home, Documentary: Sagebrush Clueless, Drama: Spice Sorority, Family: Sunset Racer, Foreign: Illusion Amelie, Wash Heavenly, Games: Sleuth Orient, Suit Walls, Horror: Ali Forever, New: Boulevard Mob, Fatal Haunted, Loverboy Attacks, Troopers Metal, Sports: Divorce Shining, Driver Annie, Holes Brannigan, Neighbors Charade, Star Operation, Travel: Frogmen Breaking
115	Harrison	Bale	Animation: Double Wrath, Nash Chocolat, Punk Divorce, Thief Pelican, Children: Walls Artist, Comedy: Rushmore Mermaid, Documentary: Wagon Jaws, Wedding Apollo, Drama: Greedy Roots, Family: Half Outfield, Homicide Peach, Foreign: Ballroom Mockingbird, Doubtfire Labyrinth, Lose Inch, Muppet Mile, Past Suicides, Games: Fantasia Park, Horror: Elephant Trojan, Lady Stage, Rollercoaster Bringing, New: Pluto Oleander, Sting Personal, Wyoming Storm, Sci-Fi: Badman Dawn, Random Go, Wonderland Christmas, Sports: Groove Fiction, Perdition Fargo
116	Dan	Streep	Action: Bull Shawshank, Animation: Argonauts Town, Children: Backlash Undefeated, Comedy: Vertigo Northwest, Documentary: French Holiday, Heavyweights Beast, Newsies Story, Foreign: Catch Amistad, Mixed Doors, Games: Roof Champion, Wanda Chamber, Horror: Panic Club, Music: Grosse Wonderful, Outfield Massacre, New: Boulevard Mob, Jekyll Frogmen, Jungle Closer, Sci-Fi: Frisco Forrest, Sports: Holes Brannigan, Mummy Creatures, Steers Armageddon, Travel: Born Spinal, Igby Maker, Shanghai Tycoon
117	Renee	Tracy	Action: Handicap Boondock, Quest Mussolini, Animation: Thief Pelican, Children: Hollywood Anonymous, Invasion Cyclone, Sundance Invasion, Classics: Creepers Kane, Hope Tootsie, Million Ace, Comedy: Connection Microcosmos, Documentary: Smoking Barbarella, Untouchables Sunrise, Drama: Rocky War, Family: Effect Gladiator, Maguire Apache, Rage Games, Secrets Paradise, Foreign: Alien Center, Doubtfire Labyrinth, Frida Slipper, Informer Double, Rocketeer Mother, Games: Fire Wolves, Music: Silence Kane, Sci-Fi: Eyes Driving, Spirited Casualties, Sports: Aladdin Calendar, Artist Coldblooded, Crusade Honey, Travel: Coma Head, Desperate Trainspotting, Shane Darkness, Shawshank Bubble
118	Cuba	Allen	Children: Maker Gables, Robbers Joon, Strangelove Desire, Comedy: Velvet Terminator, Documentary: Ship Wonderland, Drama: West Lion, Family: King Evolution, President Bang, Foreign: Fiction Christmas, Happiness United, Orange Grapes, War Notting, Games: Chicago North, Horror: Arachnophobia Rollercoaster, Music: Grosse Wonderful, New: Chaplin License, Mannequin Worst, Sci-Fi: Armageddon Lost, Badman Dawn, Barbarella Streetcar, Cincinatti Whisperer, Metropolis Coma, Sports: Lesson Cleopatra, Travel: Arsenic Independence, Papi Necklace
119	Warren	Jackman	Action: American Circus, Sky Miracle, Animation: Oz Liaisons, Potter Connecticut, Children: Language Cowboy, Shepherd Midsummer, Comedy: Submarine Bed, Vertigo Northwest, Documentary: Heavyweights Beast, Ship Wonderland, Drama: Beethoven Exorcist, Chill Luck, Coneheads Smoochy, Confessions Maguire, Hobbit Alien, Lies Treatment, Foreign: Meet Chocolate, Rocketeer Mother, Town Ark, Games: Grinch Massage, Name Detective, Horror: Commandments Express, Music: Impact Aladdin, Monster Spartacus, Oleander Clue, New: Runaway Tenenbaums, Sci-Fi: Badman Dawn, Hamlet Wisdom, Sports: Mermaid Insects, Shakespeare Saddle, Travel: Boondock Ballroom, Superfly Trip
120	Penelope	Monroe	Action: Park Citizen, Rear Trading, Trip Newton, Animation: Dares Pluto, Juggler Hardly, Children: Christmas Moonshine, Doctor Grail, Holocaust Highball, Family: Bedazzled Married, Dinosaur Secretary, Pittsburgh Hunchback, Range Moonwalker, Foreign: Hellfighters Sierra, Orange Grapes, Games: Rouge Squad, Horror: Reef Salute, Spirit Flintstones, Music: Driving Polish, New: Chinatown Gladiator, Money Harold, Wyoming Storm, Sports: Poseidon Forever, Tourist Pelican, Travel: Basic Easy, Leathernecks Dwarfs, Order Betrayed, Tomatoes Hellfighters
121	Liza	Bergman	Animation: Clash Freddy, Classics: Extraordinary Conquerer, October Submarine, Documentary: Wedding Apollo, Drama: Craft Outfield, Paycheck Wait, Scorpion Apollo, Family: Jedi Beneath, Sensibility Rear, Foreign: Command Darling, Crystal Breaking, Gentlemen Stage, Games: Chicago North, Panky Submarine, Horror: Desert Poseidon, Paris Weekend, Texas Watch, Music: Clue Grail, Deer Virginian, Enemy Odds, Terminator Club, New: Stock Glass, Sci-Fi: Frisco Forrest, Identity Lover, Sports: Lesson Cleopatra
122	Salma	Nolte	Action: Antitrust Tomatoes, Lust Lock, Animation: Falcon Volume, Ishtar Rocketeer, Juggler Hardly, Oz Liaisons, Children: Clockwork Paradise, Doctor Grail, Jumping Wrath, Classics: Color Philadelphia, Family: Blues Instinct, Siege Madre, Foreign: War Notting, Wash Heavenly, Games: Details Packer, Panky Submarine, Horror: Zhivago Core, Music: Birdcage Casper, Clones Pinocchio, Go Purple, Personal Ladybugs, Rebel Airport, New: Amistad Midsummer, Sci-Fi: Nemo Campus, Travel: Fellowship Autumn
123	Julianne	Dench	Action: Berets Agent, Bull Shawshank, Lord Arizona, Animation: Desire Alien, Double Wrath, Titanic Boondock, Children: Shepherd Midsummer, Classics: Dynamite Tarzan, Jeepers Wedding, Requiem Tycoon, Documentary: Adaptation Holes, Mighty Luck, Modern Dorado, Untouchables Sunrise, Family: Atlantis Cause, Hunting Musketeers, Jedi Beneath, Foreign: Chocolate Duck, Cowboy Doom, Doubtfire Labyrinth, Horror: Karate Moon, Monterey Labyrinth, New: Ridgemont Submarine, Sci-Fi: Cincinatti Whisperer, Disturbing Scarface, Suicides Silence, Sports: Honey Ties, Hysterical Grail, Kramer Chocolate, Mile Mulan, Travel: Enough Raging, Worker Tarzan
124	Scarlett	Bening	Children: Full Flatliners, Invasion Cyclone, Classics: Creepers Kane, Comedy: Snatch Slipper, Submarine Bed, Drama: Beethoven Exorcist, Luck Opus, Seattle Expecations, Tenenbaums Command, Foreign: Doubtfire Labyrinth, Reservoir Adaptation, Games: Bulworth Commandments, Feathers Metal, Roof Champion, Music: Words Hunter, Youth Kick, New: Amistad Midsummer, Eve Resurrection, Sci-Fi: Fiddler Lost, Identity Lover, Sports: California Birds, Dude Blindness, Durham Panky, Flatliners Killer, Travel: Moulin Wake, Shawshank Bubble
125	Albert	Nolte	Action: Dragon Squad, Handicap Boondock, Patriot Roman, Children: Doctor Grail, Idols Snatchers, Comedy: Crazy Home, Flintstones Happiness, Memento Zoolander, Documentary: Bed Highball, Kill Brotherhood, Drama: Bright Encounters, Dalmations Sweden, Pity Bound, Family: Confused Candles, Homicide Peach, Manchurian Curtain, Rage Games, Foreign: Brooklyn Desert, Hellfighters Sierra, Mixed Doors, Newton Labyrinth, Trap Guys, Games: Volcano Texas, Horror: Watership Frontier, Music: Taxi Kick, Sci-Fi: Camelot Vacation, Frisco Forrest, Goldmine Tycoon, Mourning Purple, Sports: Gleaming Jawbreaker, Honey Ties
126	Frances	Tomei	Action: American Circus, Crow Grease, Animation: Crossroads Casualties, Children: Gorgeous Bingo, Invasion Cyclone, Classics: Iron Moon, Comedy: Fireball Philadelphia, Documentary: Beach Heartbreakers, Bonnie Holocaust, Cupboard Sinners, Family: Atlantis Cause, Hocus Frida, Foreign: Madness Attacks, Horror: Arabia Dogma, New: Breaking Home, Platoon Instinct, Sci-Fi: Goodfellas Salute, Suicides Silence, Sports: Drop Waterfront, Durham Panky, Squad Fish, Travel: Escape Metropolis, Games Bowfinger
127	Kevin	Garland	Action: Trip Newton, Animation: Argonauts Town, Wait Cider, Children: Backlash Undefeated, Clockwork Paradise, Ghost Groundhog, Maker Gables, Microcosmos Paradise, Classics: Westward Seabiscuit, Comedy: Caper Motions, Daddy Pittsburgh, Gunfight Moon, Mystic Truman, Documentary: Show Lord, Drama: Blade Polish, Goldfinger Sensibility, Scorpion Apollo, Family: Natural Stock, Rage Games, Resurrection Silverado, Foreign: Baby Hall, Informer Double, Orange Grapes, Games: Chicago North, Grit Clockwork, Horror: Rules Human, Music: Freaky Pocus, Heavenly Gun, Song Hedwig, New: Sting Personal, Sci-Fi: Stallion Sundance, Sports: Satisfaction Confidential, Travel: Enough Raging
128	Cate	Mcqueen	Action: Darn Forrester, Animation: Flying Hook, Massage Image, Potter Connecticut, Pride Alamo, Children: Comancheros Enemy, Doctor Grail, Jersey Sassy, Classics: Towers Hurricane, Comedy: Caper Motions, Searchers Wait, Snatch Slipper, Documentary: French Holiday, Hawk Chill, Pacific Amistad, Drama: Virgin Daisy, Family: Blood Argonauts, Gables Metropolis, Games: Name Detective, Volcano Texas, Horror: Patton Interview, Watership Frontier, Music: Insider Arizona, Legend Jedi, New: Salute Apollo, Sci-Fi: Annie Identity, Fiddler Lost, Trojan Tomorrow, Sports: Perdition Fargo, Travel: Factory Dragon
129	Daryl	Crawford	Action: Barefoot Manchurian, Animation: Borrowers Bedazzled, Sleepless Monsoon, Classics: Color Philadelphia, Dracula Crystal, Island Exorcist, Wasteland Divine, Comedy: Daddy Pittsburgh, Downhill Enough, Strictly Scarface, Velvet Terminator, Documentary: Brotherhood Blanket, Spoilers Hellfighters, Drama: Diary Panic, Hobbit Alien, Treatment Jekyll, Family: Gandhi Kwai, Half Outfield, Foreign: Hoosiers Birdcage, Illusion Amelie, Opus Ice, Pearl Destiny, Purple Movie, Games: Moonwalker Fool, Pizza Jumanji, New: Unbreakable Karate, Sci-Fi: Goldmine Tycoon, License Weekend, Mourning Purple, Travel: Speed Suit
130	Greta	Keitel	Action: Grail Frankenstein, Magnolia Forrester, Suspects Quills, Animation: Dares Pluto, Flying Hook, Classics: Arizona Bang, Loathing Legally, Requiem Tycoon, Comedy: Jaws Harry, Drama: Bunch Minds, Family: Atlantis Cause, Foreign: Calendar Gunfight, Highball Potter, Hoosiers Birdcage, Illusion Amelie, Games: Ladybugs Armageddon, Horror: Alabama Devil, Pulp Beverly, Music: Monster Spartacus, Sci-Fi: Annie Identity, Badman Dawn, Vacation Boondock, Sports: Image Princess, Saturday Lambs, Slipper Fidelity, Travel: Basic Easy, Wolves Desire
131	Jane	Jackman	Animation: Potter Connecticut, Children: Backlash Undefeated, Beneath Rush, Idols Snatchers, Legally Secretary, Classics: Hope Tootsie, Documentary: Dancing Fever, Rainbow Shock, Drama: Luck Opus, Family: Braveheart Human, Chocolat Harry, Jedi Beneath, Foreign: Scissorhands Slums, Horror: Karate Moon, Temple Attraction, Music: Outfield Massacre, Uncut Suicides, New: Flamingos Connecticut, Hours Rage, Money Harold, Sci-Fi: Silverado Goldfinger, Sports: Caribbean Liberty, Groove Fiction, Slipper Fidelity, Talented Homicide
132	Adam	Hopper	Action: Clueless Bucket, Mockingbird Hollywood, Children: Noon Papi, Classics: Towers Hurricane, Comedy: Heaven Freedom, Saddle Antitrust, Documentary: Clerks Angels, Princess Giant, Drama: Torque Bound, Family: Blood Argonauts, Gables Metropolis, Grease Youth, Foreign: Fiction Christmas, Horror: Train Bunch, Music: Chamber Italian, Masked Bubble, Words Hunter, New: Loverboy Attacks, Sleepy Japanese, Sci-Fi: Blindness Gun, Open African, Vacation Boondock
133	Richard	Penn	Action: Darko Dorado, Montezuma Command, Children: Empire Malkovich, Model Fish, Classics: Pajama Jawbreaker, Comedy: Airplane Sierra, Groundhog Uncut, Heaven Freedom, Documentary: Wagon Jaws, Drama: Coneheads Smoochy, Gone Trouble, Lebowski Soldiers, Tenenbaums Command, Family: Resurrection Silverado, Foreign: Illusion Amelie, Horror: Gaslight Crusade, Music: Balloon Homeward, Chamber Italian, New: Earth Vision, Oklahoma Jumanji, Sleepy Japanese, Vampire Whale, Sci-Fi: Frisco Forrest, Guys Falcon, Hanky October, Sports: Instinct Airport, Travel: Enough Raging, Fugitive Maguire, Superfly Trip, Tomatoes Hellfighters
134	Gene	Hopkins	Action: Dragon Squad, Truman Crazy, Uprising Uptown, Animation: Doors President, Pond Seattle, Children: Model Fish, Tootsie Pilot, Classics: Frost Head, Comedy: Hedwig Alter, Documentary: Deep Crusade, Drama: Pity Bound, Torque Bound, Family: Chisum Behavior, Games: Nightmare Chill, Suit Walls, Music: Clue Grail, Elf Murder, Vanishing Rocky, New: Mannequin Worst, Sci-Fi: Chainsaw Uptown, Panther Reds, Travel: Gump Date
